{
  "id": "diag_dependency_cve_001",
  "contract_version": "v1",
  "schema_url": "https://github.com/CloudSpaceLab/ai-logfixer/contracts/v1/schemas/diagnosis-result.schema.json",
  "status": "complete",
  "summary": "A vulnerable dependency version is present in the service runtime.",
  "confidence": 0.91,
  "suspected_root_cause": "The deployed package version matches a known vulnerable range.",
  "affected_services": ["identity-api"],
  "evidence_items": [
    {
      "id": "ev_cve_001",
      "type": "cve",
      "source": "dependency-scan",
      "timestamp": "2026-05-21T08:10:00Z",
      "title": "Known vulnerable package detected",
      "summary": "The deployed dependency version matches a known CVE advisory.",
      "raw_excerpt": "package=example-auth version=1.4.2 advisory=CVE-2026-0001",
      "redaction_state": "not_needed",
      "related_ids": [],
      "ui_hints": {
        "icon": "shield-alert",
        "tone": "danger",
        "sections": ["cve", "dependencies"]
      },
      "external_refs": [],
      "knowledge_refs": []
    }
  ],
  "recommendations": [
    {
      "id": "rec_vendor_patch_001",
      "title": "Apply vendor security patch",
      "reason": "The current dependency version is vulnerable.",
      "confidence": 0.9,
      "steps": ["Review vendor advisory.", "Stage patched version.", "Request production approval."],
      "required_permissions": ["dependency:read", "deploy:approve"],
      "estimated_risk": "medium_risk",
      "requires_approval": true
    }
  ],
  "patch_plan": {
    "id": "patch_dependency_001",
    "target_type": "dependency",
    "target_refs": ["identity-api/example-auth"],
    "diff_preview": {
      "before": "example-auth@1.4.2",
      "after": "example-auth@1.4.5"
    },
    "risk_level": "medium_risk",
    "requires_approval": true,
    "blocked_reasons": []
  },
  "rollback_plan": {
    "id": "rollback_dependency_001",
    "rollback_type": "unavailable",
    "snapshot_refs": [],
    "restore_steps": [],
    "limitations": [
      "Rollback would restore a vulnerable package and is not considered safe."
    ],
    "risk_level": "blocked",
    "requires_manual_review": true
  },
  "safety_classification": "medium_risk",
  "display_status": "Security patch recommended",
  "user_message": "Rollback is unavailable because it would restore the vulnerable package.",
  "next_actions": [],
  "timeline_events": [],
  "external_refs": [],
  "knowledge_refs": [],
  "created_at": "2026-05-21T08:11:00Z"
}
